{
  "$schema": "https://json-schema.org/draft/2020-12/schema",
  "$id": "https://8978.ai/schemas/development-authority-migration-execution-record.schema.json",
  "title": "Development Authority Migration Execution Record",
  "type": "object",
  "additionalProperties": false,
  "required": ["schemaVersion","status","governing","environment","source","authorization","operator","preflight","backup","migration","postState","externalEffects","partialFailurePolicy","errors","recordedAt"],
  "properties": {
    "schemaVersion":{"const":"1.0.0"},
    "status":{"enum":["COMPLETED","STOPPED_NO_MUTATION","STOPPED_PARTIAL"]},
    "governing":{"const":false},
    "environment":{"const":"development"},
    "source":{"type":"object","additionalProperties":false,"required":["reviewedCommit","packetPath","packetSha256"],"properties":{"reviewedCommit":{"const":"b2e3188b28b7c9071e267e69e90c374650747035"},"packetPath":{"const":"deployment/development-authority-migration-execution-packet.json"},"packetSha256":{"const":"ab865340c48279e6e5654e8e6b0ed52cb9d4af28115c49b47d787ad1ec205d8a"}}},
    "authorization":{"type":"object","additionalProperties":false,"required":["ownerDecisionId","ownerAuthorizationDigest","accountId","executionAuthorized","authorizedAttemptLimit"],"properties":{"ownerDecisionId":{"type":"string","minLength":1},"ownerAuthorizationDigest":{"type":"string","pattern":"^sha256:[a-f0-9]{64}$"},"accountId":{"const":"de5e0273347b0b4c5f8f4e554aa2288f"},"executionAuthorized":{"const":true},"authorizedAttemptLimit":{"const":1}}},
    "operator":{"type":"object","additionalProperties":false,"required":["principalId","authenticatedAccountId"],"properties":{"principalId":{"type":"string","minLength":1},"authenticatedAccountId":{"type":"string","minLength":1}}},
    "preflight":{"type":"object","additionalProperties":false,"required":["completed","databaseName","databaseId","region","jurisdiction","version","tableCount","fileSizeBytes","identityMatched","emptyStateMatched"],"properties":{"completed":{"type":"boolean"},"databaseName":{"type":["string","null"]},"databaseId":{"type":["string","null"]},"region":{"type":["string","null"]},"jurisdiction":{"type":["string","null"]},"version":{"type":["string","null"]},"tableCount":{"type":["integer","null"],"minimum":0},"fileSizeBytes":{"type":["integer","null"],"minimum":0},"identityMatched":{"type":"boolean"},"emptyStateMatched":{"type":"boolean"}}},
    "backup":{"type":"object","additionalProperties":false,"required":["bookmarkCaptured","bookmark","exportCaptured","exportSha256","exportSizeBytes","exportCommitted"],"properties":{"bookmarkCaptured":{"type":"boolean"},"bookmark":{"type":["string","null"]},"exportCaptured":{"type":"boolean"},"exportSha256":{"type":["string","null"],"pattern":"^[a-f0-9]{64}$"},"exportSizeBytes":{"type":["integer","null"],"minimum":1},"exportCommitted":{"const":false}}},
    "migration":{"type":"object","additionalProperties":false,"required":["attemptCount","applyCommand","invoked","outcome","pendingBefore","applied","pendingAfter"],"properties":{"attemptCount":{"type":"integer","minimum":0},"applyCommand":{"const":"wrangler d1 migrations apply 8978-ai-authority-dev --remote --config deployment/wrangler.authority-migrations.jsonc"},"invoked":{"type":"boolean"},"outcome":{"enum":["NOT_INVOKED","SUCCEEDED","FAILED","INTERRUPTED","AMBIGUOUS"]},"pendingBefore":{"type":["array","null"],"items":{"type":"string","minLength":1}},"applied":{"type":"array","items":{"type":"string","minLength":1}},"pendingAfter":{"type":["array","null"],"items":{"type":"string","minLength":1}}}},
    "postState":{"type":"object","additionalProperties":false,"required":["retrieved","tableCount","fileSizeBytes","migrationsApplied","migrationBookkeepingRowsCreated","remoteSchemaVerified"],"properties":{"retrieved":{"type":"boolean"},"tableCount":{"type":["integer","null"],"minimum":0},"fileSizeBytes":{"type":["integer","null"],"minimum":0},"migrationsApplied":{"type":"boolean"},"migrationBookkeepingRowsCreated":{"type":"boolean"},"remoteSchemaVerified":{"const":false}}},
    "externalEffects":{"type":"object","additionalProperties":false,"required":["runtimeBindingInstalled","workerCreatedOrDeployed","workflowCreatedOrTriggered","queueConnectedOrPublished","secretOrKeyChanged","authorityDataWritten","projectKnowledgeSeeded","activationEvidenceWritten","activationPlanUpdated","deploymentActivated","productionOrCustomerResourceTouched"],"properties":{"runtimeBindingInstalled":{"const":false},"workerCreatedOrDeployed":{"const":false},"workflowCreatedOrTriggered":{"const":false},"queueConnectedOrPublished":{"const":false},"secretOrKeyChanged":{"const":false},"authorityDataWritten":{"const":false},"projectKnowledgeSeeded":{"const":false},"activationEvidenceWritten":{"const":false},"activationPlanUpdated":{"const":false},"deploymentActivated":{"const":false},"productionOrCustomerResourceTouched":{"const":false}}},
    "partialFailurePolicy":{"type":"object","additionalProperties":false,"required":["restoreAttempted","retryAttempted","cleanupAttempted","deletionAttempted"],"properties":{"restoreAttempted":{"const":false},"retryAttempted":{"const":false},"cleanupAttempted":{"const":false},"deletionAttempted":{"const":false}}},
    "errors":{"type":"array","items":{"type":"string","minLength":1}},
    "recordedAt":{"type":"string","format":"date-time"}
  }
}
